ProductGroupID,GroupName,GroupDescription,Category,SubCategory,Department,CreatedAt,UpdatedAt,IsActive,ImageURL
142,loss,Leader commercial admit write college guess. Interview meeting most important community.,city,person,nature,2022-03-28 01:30:19,2024-02-14 11:00:37,False,https://placekitten.com/510/142
143,consumer,Artist red final recent. Wear interview head can rest race few. System learn bank in reach billion.,thing,public,director,2021-07-31 06:02:42,2024-01-30 14:26:46,True,https://placeimg.com/659/421/any
144,east,Through shake under look tough market success realize. As evening claim rock choose far air.,among,force,officer,2022-12-06 22:00:51,2024-01-24 02:07:25,True,https://dummyimage.com/826x109
145,too,Whatever fast friend south movie. Finally include protect room positive inside.,commercial,policy,conference,2023-04-14 15:45:55,2024-05-15 03:06:27,False,https://www.lorempixel.com/321/257
146,respond,Under until for box thousand. Along necessary end organization discuss us source.,example,able,activity,2020-04-13 00:24:14,2024-06-23 20:17:13,False,https://placekitten.com/18/641
147,fire,At population participant month often type recognize. Thousand collection full especially while.,service,direction,easy,2020-01-18 19:28:50,2024-01-20 16:42:17,False,https://placekitten.com/359/279
148,medical,Forward stage country institution. Hot believe because long side enter country. Little occur time.,vote,prove,skill,2023-12-01 04:03:50,2024-06-10 02:44:00,False,https://dummyimage.com/466x716
149,spend,Billion experience heart too. Head force west open almost either inside.,if,director,student,2024-03-17 22:46:52,2024-06-06 15:52:47,False,https://dummyimage.com/656x58
150,read,"Note level surface four could.
Technology treat later stop. Nor score front modern evening.",hand,his,card,2022-01-29 12:22:07,2024-06-29 03:55:36,False,https://dummyimage.com/406x132
151,light,You impact state person attention suddenly girl. Travel race across mother financial.,ask,east,phone,2023-08-28 12:41:13,2024-02-01 02:47:41,True,https://dummyimage.com/972x627
152,test,Character forward build building operation tell. Debate shake onto who. Most hour eye tree message.,boy,build,can,2023-04-22 03:42:12,2024-02-11 03:58:02,False,https://dummyimage.com/679x779
153,for,Until music old inside picture grow. Place clearly half music stock. Piece price positive director.,care,tonight,society,2023-01-01 17:57:26,2024-05-24 08:42:14,True,https://dummyimage.com/371x645
154,prepare,Up include painting rate stock music culture degree. Nation protect find.,no,close,serve,2024-04-13 06:57:45,2024-05-07 19:16:49,True,https://www.lorempixel.com/426/716
155,north,Relate model begin form. Baby support eat foot.,commercial,sit,wife,2021-06-23 20:08:44,2024-05-19 19:28:57,False,https://placekitten.com/611/54
156,create,Through system thus without win by. Thus population voice in could. Human ahead sometimes prevent.,expert,peace,loss,2021-12-15 22:03:45,2024-01-19 12:13:36,True,https://dummyimage.com/120x36
157,fund,Actually serve game theory. Reason race top must share.,however,position,price,2023-01-16 06:48:47,2024-03-07 16:14:53,True,https://placekitten.com/688/985
158,develop,Price people impact local. Whether artist model state property history.,quality,return,season,2020-09-02 09:22:43,2024-05-31 16:46:41,False,https://placekitten.com/321/461
159,situation,If no effect husband impact.,station,must,child,2023-10-13 16:11:57,2024-02-14 08:16:54,False,https://placeimg.com/150/579/any
160,society,Occur none very door. It director under clearly.,example,prove,add,2021-11-28 22:44:46,2024-01-02 10:44:08,True,https://dummyimage.com/672x679
161,contain,Include whose situation like computer wall rule. Action series smile difference.,support,follow,style,2020-06-17 02:28:46,2024-03-18 03:00:08,False,https://dummyimage.com/311x268
162,character,Parent behavior hair international live. Might address manager move.,statement,baby,little,2021-03-14 09:51:24,2024-07-03 07:02:13,True,https://dummyimage.com/404x411
163,already,Behind free table wait also. Upon seat discussion war company lose seem. Matter find phone.,stay,chair,attack,2021-12-24 21:38:57,2024-05-23 15:42:10,False,https://dummyimage.com/548x172
164,happen,Through place budget professional rich. Use space ago your rest consumer. Garden question to stand.,her,local,employee,2020-04-06 11:26:42,2024-02-07 03:37:41,True,https://placekitten.com/560/741
165,three,"Prepare around visit manage forget.
House office can factor case nor above voice.",majority,should,court,2020-11-07 01:44:13,2024-03-02 01:52:40,False,https://placekitten.com/66/610
166,talk,Join time fine second peace. Official them man. Business with rule office discover.,myself,song,hear,2022-12-03 21:07:49,2024-04-17 19:56:10,True,https://placekitten.com/693/661
167,attention,Phone yet budget information piece total. Social six size so artist wonder offer experience.,significant,himself,administration,2023-07-08 03:40:50,2024-04-26 04:25:41,True,https://placekitten.com/470/455
168,adult,Meeting song before city central thus. Establish clearly drive.,while,professional,perhaps,2022-02-05 18:47:01,2024-01-08 08:14:06,False,https://www.lorempixel.com/927/185
169,letter,Message politics write per call. Career water board world indicate spring agent.,recent,strong,wonder,2020-03-19 08:36:11,2024-01-25 15:14:55,True,https://www.lorempixel.com/86/993
170,pull,Fire care daughter. Close improve dream action share simple ground.,cultural,threat,way,2020-06-12 20:31:41,2024-03-27 02:59:43,True,https://dummyimage.com/558x27
171,wait,Official statement kind brother nation. None word onto upon every main plant.,religious,ever,tonight,2023-01-30 11:12:56,2024-05-02 21:47:37,False,https://placekitten.com/882/187
172,too,"Skill bar guy speak interesting institution.
Music their decade spring specific radio guess.",scientist,give,more,2023-05-16 03:49:01,2024-02-11 22:28:46,False,https://www.lorempixel.com/92/534
173,professional,Plant type public national. Dream four agent around because.,quality,officer,glass,2023-08-14 21:57:46,2024-02-27 03:16:00,False,https://placekitten.com/806/92
174,cut,Just consider mouth onto return. Call paper not.,grow,it,hope,2024-02-19 17:16:43,2024-06-08 19:47:50,True,https://placekitten.com/880/534
175,chair,Between discuss bit any. Raise similar effect.,mouth,party,Democrat,2021-01-30 05:50:19,2024-06-02 06:16:04,True,https://dummyimage.com/462x701
176,office,Money table so really word past large. Process ago country record.,hundred,skill,other,2021-10-09 04:14:14,2024-03-31 13:01:16,False,https://placekitten.com/89/859
177,important,Moment yeah force recently painting various. Yard about situation he already full eat.,hope,important,produce,2020-07-19 20:55:36,2024-04-18 16:54:31,True,https://dummyimage.com/634x943
178,they,Water international card two six design. Nice sort reduce thought behind they against.,choose,within,enjoy,2021-11-04 15:48:40,2024-04-13 01:24:36,True,https://placekitten.com/301/367
179,hair,Building determine order stuff animal. Environment everything evidence.,trial,teach,page,2021-03-20 16:11:33,2024-06-17 08:44:33,False,https://placekitten.com/1017/863
180,western,Be worry partner. Rise necessary matter wall may power this.,run,author,may,2024-04-15 15:52:57,2024-04-21 07:48:29,False,https://dummyimage.com/44x583
181,need,Little almost any game. Still statement writer six trouble.,article,indicate,lawyer,2021-07-10 09:24:24,2024-05-11 08:54:05,False,https://www.lorempixel.com/631/618
182,together,Radio person couple performance nothing quite research. Lot personal order.,husband,minute,medical,2024-02-06 03:31:57,2024-05-12 20:32:04,False,https://placekitten.com/773/700
183,after,Over carry kid anything. Suggest sing require forward expert reveal again might.,poor,sense,away,2024-03-20 03:35:35,2024-05-30 11:13:56,True,https://placeimg.com/774/158/any
184,letter,Why chair hear. Stop then win central eye prepare.,environment,and,right,2022-03-24 09:26:55,2024-04-27 21:41:15,False,https://www.lorempixel.com/799/856
185,fall,Each special those speech. If assume describe peace. Product require house ask name this picture.,recent,coach,hope,2021-05-30 23:45:53,2024-06-28 12:18:33,True,https://dummyimage.com/144x898
186,pattern,Traditional because American anything. Nice measure team population your.,option,political,possible,2023-11-16 07:20:11,2024-05-30 00:22:39,True,https://placekitten.com/533/747
187,data,Together economy wind hard simply who. Ever account serve often it. Friend drug choice.,seek,industry,seem,2020-06-07 05:07:58,2024-06-26 03:43:32,True,https://placekitten.com/382/24
188,choose,Hope door let however might senior. Movement this spend need green them list.,pattern,hard,while,2022-05-30 22:11:30,2024-06-17 19:26:03,False,https://www.lorempixel.com/369/633
189,every,Energy interest can likely single. Sign evidence radio suddenly event over ask.,after,could,life,2020-03-23 01:28:07,2024-01-30 11:05:10,False,https://www.lorempixel.com/738/227
190,effort,Center have impact close life. Hair thousand structure federal.,them,operation,company,2023-07-11 07:05:23,2024-03-04 12:03:51,False,https://placeimg.com/857/147/any
191,behind,City court case. Position ability now describe since. Building feeling so else knowledge total PM.,radio,line,because,2021-07-15 22:43:27,2024-06-20 00:41:06,False,https://dummyimage.com/534x990
192,improve,Whole amount every indicate. Process the growth sure guy parent.,material,high,consider,2020-08-01 07:57:17,2024-01-04 22:42:08,True,https://www.lorempixel.com/562/147
193,health,Late suffer statement why total onto. Your material interesting action learn law.,central,listen,then,2022-01-09 01:37:30,2024-02-14 11:23:14,True,https://dummyimage.com/706x597
194,pretty,Yeah natural approach for their unit. Cause fear start away.,back,plant,break,2020-11-09 23:38:25,2024-04-14 01:53:27,True,https://www.lorempixel.com/528/131
195,soon,Good political meeting yet speech fine response significant.,kind,step,film,2022-02-08 21:53:51,2024-03-12 15:47:24,False,https://placeimg.com/169/280/any
196,almost,Dog by until because nearly. Me else six commercial decide. Assume every PM reason.,factor,pattern,dark,2022-12-21 02:54:24,2024-02-27 20:42:29,False,https://placeimg.com/134/341/any
197,both,Quality challenge talk loss enough. A democratic two.,lot,defense,put,2020-08-26 17:21:03,2024-05-18 21:10:09,True,https://placekitten.com/912/578
198,college,Perform check money east movement born. Or maybe kid against approach since.,work,claim,low,2021-09-10 11:09:35,2024-06-21 06:31:02,False,https://placeimg.com/72/909/any
199,level,Local sister piece spring able town. Interesting full teacher community boy president.,girl,beautiful,us,2020-05-21 07:45:23,2024-01-31 15:16:14,True,https://dummyimage.com/498x62
200,best,Not kitchen indicate walk. Amount anything this move important cold doctor.,consumer,perform,sea,2021-03-03 18:57:40,2024-04-01 09:25:03,False,https://placekitten.com/732/784
201,half,Level end top though personal. Mean house after certainly.,do,yard,century,2023-09-06 20:32:40,2024-02-27 23:06:40,True,https://placekitten.com/162/508
202,walk,Low top along attention. Social similar coach business hold. Size activity near movie.,say,single,pretty,2023-04-16 20:11:03,2024-05-01 07:02:25,True,https://dummyimage.com/742x67
203,hope,Unit view candidate agreement. Soldier fly production I note.,seek,rule,wrong,2022-03-10 21:53:53,2024-03-24 14:29:09,False,https://dummyimage.com/876x960
204,property,Sign your health indicate. Official tell truth four chair direction about agreement.,various,couple,before,2020-08-27 15:05:17,2024-04-12 10:56:46,False,https://www.lorempixel.com/1013/89
205,system,Daughter include cause small. First move event lawyer blood. Tough certain best consider.,despite,own,work,2020-03-23 03:08:10,2024-03-21 10:32:32,True,https://placekitten.com/701/70
206,different,This leave well make and off. Camera fall study matter couple minute.,heavy,little,candidate,2022-04-08 05:21:20,2024-05-26 15:43:54,True,https://placekitten.com/972/294
207,under,Company also especially boy heavy. Rest expect effort result.,they,organization,quality,2023-12-07 18:36:39,2024-03-26 13:14:04,True,https://placekitten.com/139/813
208,country,Major subject you least there. Past I world store.,choice,or,dog,2022-03-29 01:30:02,2024-05-29 09:01:35,False,https://www.lorempixel.com/804/679
209,maybe,Account language range pay address energy. Watch quickly common wish.,forward,natural,behavior,2021-07-02 04:03:55,2024-01-17 08:36:59,True,https://placekitten.com/467/338
210,time,Better listen event dinner move across. Week south western.,bag,such,enter,2020-07-20 20:05:18,2024-03-11 15:33:24,True,https://www.lorempixel.com/463/610
211,American,"Continue apply purpose investment itself. Behind fine low chair.
Draw explain catch.",identify,dog,true,2022-08-20 13:25:45,2024-01-02 18:08:16,False,https://placeimg.com/455/615/any
212,single,Drive for onto when shoulder. Much throughout couple. Record with yourself.,about,race,meeting,2020-09-26 02:20:23,2024-05-18 23:38:29,False,https://dummyimage.com/425x582
213,center,Serve another owner. Best put arm building rock. Interview several hair conference need face.,music,significant,American,2024-01-14 15:47:27,2024-01-18 12:52:55,True,https://placekitten.com/1/661
214,discuss,Where travel list deep magazine able space write. Paper source business range skin heart gun.,lead,who,claim,2020-01-19 15:26:24,2024-06-03 14:47:15,False,https://placekitten.com/766/792
215,else,Range whom light why white goal activity. Fact reach step throughout summer what my.,child,sure,land,2020-01-04 15:04:53,2024-06-07 07:52:33,True,https://dummyimage.com/21x854
216,near,Eight still across young Democrat. Site call score worker.,attention,after,pressure,2023-08-09 22:04:38,2024-04-29 13:20:47,False,https://placeimg.com/911/490/any
217,food,Worry receive exist whom doctor.,music,also,policy,2024-06-13 12:23:55,2024-03-26 15:08:50,True,https://placeimg.com/635/15/any
218,home,Recognize Republican economy out. Edge recently nice.,manager,campaign,voice,2022-04-02 03:22:13,2024-03-03 04:29:51,True,https://placekitten.com/613/48
219,certainly,Increase star night history. Bit case fish.,plant,score,box,2022-08-06 22:54:36,2024-04-17 06:50:04,True,https://dummyimage.com/164x405
220,her,Mission class ten small.,building,free,certain,2023-11-21 16:01:22,2024-04-10 19:26:21,False,https://placekitten.com/646/665
221,reveal,Move authority easy soldier property local think. Try kind return book game. Role case large stand.,expert,risk,such,2020-01-09 08:44:30,2024-06-15 03:06:30,True,https://placekitten.com/343/959
222,include,Tax week smile center. Study sea believe food identify.,drive,respond,reality,2021-12-17 05:19:45,2024-06-28 11:36:09,True,https://www.lorempixel.com/266/159
223,small,Son seven cell east future central forget boy. Fall trouble point career. Sister today can.,position,think,nation,2024-06-30 19:37:56,2024-04-12 00:05:10,False,https://placeimg.com/996/912/any
224,number,Seek main economic fly office piece. Compare under night management letter.,someone,young,current,2020-09-15 20:47:18,2024-02-04 17:22:05,False,https://www.lorempixel.com/393/330
225,see,Defense last over off east actually away. Magazine movement have physical. Store major while full.,cultural,mind,technology,2022-09-12 19:40:09,2024-05-15 01:03:18,False,https://placekitten.com/55/986
226,themselves,Wish appear recent. Whole attention determine already. More better various site model upon.,business,behavior,over,2020-03-26 13:39:09,2024-02-10 02:51:46,False,https://placeimg.com/843/196/any
227,real,Debate yourself have seem charge customer. Single medical eat population.,about,single,almost,2020-09-18 05:10:31,2024-07-01 07:40:33,True,https://placeimg.com/216/46/any
228,talk,Do college choice simple half standard. Many share pay night past. Election theory trouble.,simply,program,decision,2020-06-28 11:04:18,2024-03-14 04:40:05,False,https://placekitten.com/904/941
229,enough,Whose per anyone. Cover kid control Republican task.,ask,before,pass,2023-03-11 20:25:52,2024-04-19 21:56:57,True,https://www.lorempixel.com/689/376
230,fall,Teach federal material fact concern affect. Gun education every poor them.,box,return,cell,2021-02-11 08:10:18,2024-01-10 22:55:50,False,https://www.lorempixel.com/53/435
231,somebody,Move smile news often use college claim. Authority draw consumer somebody religious subject.,husband,likely,among,2021-05-12 21:49:16,2024-03-19 23:16:02,False,https://dummyimage.com/707x261
232,rise,Alone not share degree information feeling serve. Check year because speech.,hear,per,although,2020-11-13 07:39:59,2024-04-03 17:23:54,False,https://placeimg.com/33/702/any
233,member,City rule energy if hot environment land spend. Small administration outside well carry I task.,could,idea,two,2024-05-18 20:38:35,2024-06-19 19:52:27,True,https://dummyimage.com/989x445
234,speech,Speech open research nothing left. Skin north Mrs everybody per chair. Son herself detail after.,meeting,rest,low,2023-02-20 10:01:19,2024-01-18 05:29:31,False,https://dummyimage.com/648x971
235,because,Product result power certainly many me east. Senior probably should.,structure,strategy,indeed,2023-04-23 06:04:13,2024-03-28 05:38:57,True,https://dummyimage.com/70x847
236,time,Test low learn common. Start probably begin sign. Budget better season cover happy know believe.,century,control,represent,2020-05-10 13:06:21,2024-02-08 23:25:58,True,https://placeimg.com/896/191/any
237,lead,Process government hospital report necessary store. Research make remain despite into fire arm.,case,follow,impact,2020-03-12 13:23:09,2024-02-21 15:11:18,False,https://placeimg.com/914/217/any
238,arm,Member would blue a. Again parent fear field size tax.,record,according,produce,2020-12-29 08:13:23,2024-04-15 14:24:54,False,https://www.lorempixel.com/64/31
239,professional,Away value agent population which city. Officer article letter majority want avoid song government.,newspaper,practice,source,2020-03-08 18:43:08,2024-02-16 15:09:41,True,https://www.lorempixel.com/662/723
240,yourself,Whom performance drug anyone note better hour data.,team,suggest,statement,2020-04-15 18:05:57,2024-04-24 04:03:08,False,https://placekitten.com/34/191
241,fill,Truth discover maybe add house build. Young war above long product adult check.,action,human,light,2021-08-09 01:29:31,2024-02-21 22:29:53,False,https://dummyimage.com/297x64
242,same,Again force environmental. Least music owner anything pick tonight.,real,girl,nation,2024-01-09 12:51:57,2024-01-07 19:40:29,True,https://placekitten.com/888/527
243,chance,Drive method truth detail capital card yes. Myself study knowledge today three.,dark,notice,figure,2023-06-18 01:59:23,2024-01-13 04:14:20,True,https://dummyimage.com/554x820
244,after,Agency who occur wear off read. Decision stage hard record likely.,when,hospital,election,2021-08-03 23:26:41,2024-06-13 09:34:03,True,https://dummyimage.com/534x560
245,data,Major hard modern information fly hotel. Degree weight interview. Analysis quite professor.,identify,prevent,activity,2022-10-09 09:48:01,2024-04-20 08:30:10,True,https://placeimg.com/681/996/any
246,item,Like wide year ball police maintain stage. Feel audience start.,court,glass,land,2023-09-23 15:40:34,2024-05-19 04:07:18,False,https://placeimg.com/949/3/any
247,population,"Type role require news culture.
Child former most guy. Man your trouble score image heavy chair.",door,spring,eat,2023-08-14 06:41:56,2024-01-12 14:29:30,False,https://dummyimage.com/43x979
248,seven,According its cut play today hotel of activity.,trip,protect,response,2022-07-24 17:35:08,2024-05-15 06:49:34,True,https://placeimg.com/681/349/any
249,bag,Today shoulder brother light within treat.,station,affect,participant,2021-12-18 05:25:17,2024-04-02 20:52:34,True,https://placekitten.com/250/245
250,institution,Two change take exist each something just.,in,record,daughter,2020-01-09 21:02:03,2024-06-12 18:16:46,True,https://dummyimage.com/539x479
251,least,Space feeling herself hold reveal better sell cost. Too most here democratic various such.,himself,operation,produce,2022-03-06 15:03:58,2024-01-10 06:30:49,False,https://placekitten.com/459/437
252,eat,Difficult fund its imagine relationship. Marriage language hard culture from front discover.,perhaps,final,fish,2020-11-25 20:16:12,2024-04-16 23:40:58,True,https://dummyimage.com/857x469
253,seven,Available network risk serve. Man according between produce.,three,father,when,2023-09-10 08:03:25,2024-06-24 20:14:54,True,https://placeimg.com/953/38/any
254,office,That significant loss side arm bar. Create though capital quite tough condition should.,one,nation,when,2024-02-22 13:12:14,2024-03-15 04:02:23,False,https://www.lorempixel.com/233/375
255,recent,Such establish car third myself response subject manage. Degree federal but admit thing management.,floor,simply,instead,2020-01-10 17:07:40,2024-04-28 01:09:18,False,https://dummyimage.com/570x625
256,firm,Bag surface base future but. Sure hotel line training one society remain or.,animal,century,send,2023-03-22 10:15:52,2024-03-17 14:26:19,True,https://placeimg.com/911/1022/any
257,candidate,Minute suddenly news themselves education body military.,certain,statement,stuff,2021-04-15 09:28:49,2024-06-18 13:25:07,True,https://www.lorempixel.com/694/482
258,power,Street world up foot attorney health. Leave item without other year suddenly.,use,project,wrong,2021-12-19 07:54:46,2024-02-12 01:46:52,True,https://www.lorempixel.com/317/567
259,tree,New question night health chair. Draw suffer leader produce big less thing term.,outside,truth,how,2023-01-11 08:35:46,2024-07-02 08:41:13,False,https://placekitten.com/638/481
260,forget,Keep take go material prepare us part. Push single life glass.,sit,necessary,whether,2023-09-27 19:30:54,2024-04-22 18:04:43,True,https://www.lorempixel.com/212/747
261,night,During ahead glass blood allow system responsibility. Pressure staff really new.,be,development,rise,2021-05-18 08:36:33,2024-06-26 17:56:37,False,https://placeimg.com/875/416/any
262,sell,Test describe impact first. Dog society pay green rock.,treatment,board,big,2022-12-23 01:38:11,2024-02-22 05:06:37,True,https://www.lorempixel.com/256/405
263,campaign,Young family investment west it soon.,boy,maybe,rule,2020-01-26 21:12:27,2024-02-24 09:41:52,True,https://dummyimage.com/586x92
264,actually,"Street detail safe weight green never water.
Scene occur onto subject man. Way road student thus.",town,learn,back,2022-11-18 21:10:22,2024-05-28 19:13:52,False,https://dummyimage.com/58x485
265,history,Wait court let house. One man who lead yard necessary.,bill,hotel,charge,2022-10-09 22:24:25,2024-06-01 09:26:34,True,https://www.lorempixel.com/437/253
266,relationship,Win financial window individual sound however then. Concern opportunity on behind voice country.,hot,very,mouth,2023-10-06 10:51:54,2024-04-03 04:38:45,True,https://placekitten.com/230/782
267,spend,Do cause suddenly save.,fine,child,something,2023-06-25 12:57:04,2024-05-10 01:15:09,False,https://www.lorempixel.com/878/356
268,laugh,Street suddenly evidence evidence more grow bit.,school,guess,four,2023-01-08 15:08:52,2024-03-21 13:45:07,False,https://www.lorempixel.com/731/744
269,admit,Apply budget end color major business relationship. Room speak degree present out hot.,coach,be,site,2021-02-13 14:55:53,2024-04-16 06:18:47,False,https://placekitten.com/275/690
270,spend,Learn mother human project. Since will sell identify.,election,born,specific,2022-10-16 20:29:04,2024-04-29 15:11:15,False,https://www.lorempixel.com/211/537
271,analysis,Trip budget free blue little visit everybody.,thought,reach,past,2022-05-18 21:49:46,2024-07-02 12:17:42,True,https://www.lorempixel.com/525/994
272,rate,Campaign nation much left seem many. Difficult shoulder after he act student.,expect,sort,cost,2022-05-07 13:39:12,2024-05-06 17:39:01,False,https://placekitten.com/410/267
273,against,Finish buy structure need region training letter. Describe court education what. Far wrong memory.,size,process,arrive,2021-11-16 18:13:19,2024-03-28 18:25:08,False,https://placekitten.com/816/476
274,especially,Time us network fine thus more relationship. Turn teach really player.,force,bag,factor,2020-06-30 08:27:32,2024-06-13 07:33:06,True,https://dummyimage.com/42x838
275,full,Hair policy safe detail best them. Whom think fly story message wife study.,month,Mrs,large,2022-11-13 18:31:31,2024-06-18 07:12:04,False,https://placeimg.com/370/908/any
276,free,Throughout despite even around green main. Question painting hot out office process capital ask.,watch,hear,information,2020-07-24 05:29:40,2024-02-27 16:34:52,True,https://www.lorempixel.com/144/787
277,well,Again send fund decide guy safe. Green doctor activity property.,soon,without,off,2020-06-07 18:23:19,2024-04-07 09:16:22,False,https://dummyimage.com/828x520
278,quickly,Magazine hour answer too benefit. Reason pull indeed go nice baby.,clearly,step,education,2023-05-10 18:10:03,2024-06-18 17:38:26,True,https://www.lorempixel.com/581/460
279,agreement,Top approach edge live. Subject forget ahead all series skin. Who gas him.,total,in,represent,2022-08-10 20:44:10,2024-04-12 04:55:14,True,https://dummyimage.com/604x676
280,three,Across type affect security. Wait leg among life.,north,run,much,2020-07-15 19:24:32,2024-03-23 22:01:19,False,https://placeimg.com/370/239/any
281,former,Pay once practice whole shoulder. Student money pressure appear when today front.,concern,fire,sort,2024-04-08 01:37:51,2024-06-15 06:07:06,True,https://dummyimage.com/372x35
282,especially,Group already face paper gun society.,reality,social,road,2020-03-08 10:57:57,2024-01-28 21:47:59,False,https://www.lorempixel.com/705/779
