ProductGroupID,GroupName,GroupDescription,Category,SubCategory,Department,CreatedAt,UpdatedAt,IsActive,ImageURL
283,vote,Who Mrs wall bring. Provide discussion soon or information green.,second,everyone,pass,2022-08-17 11:17:14,2024-04-19 17:25:08,True,https://www.lorempixel.com/560/302
284,lawyer,Believe provide build last lose. Across discuss rock leave career quite.,notice,woman,ability,2020-04-03 02:25:40,2024-06-03 14:06:03,True,https://dummyimage.com/820x660
285,admit,Civil hit box cut high. Political against anyone head population guess some.,soldier,cell,to,2021-04-29 02:20:37,2024-01-06 20:04:53,True,https://www.lorempixel.com/690/342
286,senior,Look director yes. Possible sister party general others wonder just.,wall,case,ask,2021-01-11 15:57:28,2024-03-28 00:23:22,True,https://placeimg.com/914/459/any
287,need,"Building series mind energy thank entire.
Cost wait break attention forward. Single improve thank.",significant,want,blood,2023-07-02 09:46:44,2024-02-15 17:59:11,True,https://www.lorempixel.com/60/1005
288,suffer,Nature wonder camera bed relationship. Country easy skin east different concern nature.,dark,region,pay,2023-11-03 08:22:01,2024-06-24 23:01:23,False,https://placeimg.com/338/529/any
289,force,Deal official lead despite. New tend hospital last think. Model daughter age its sound seat.,between,professor,next,2021-05-11 14:23:31,2024-04-19 21:05:08,True,https://dummyimage.com/193x329
290,event,Whole institution past sea. It agency them democratic carry.,door,simply,page,2022-09-20 05:37:16,2024-01-31 15:51:10,False,https://placeimg.com/329/890/any
291,notice,Sure lot exactly far recent economy. Office five notice. Simple recent chair west.,quickly,simply,seven,2021-09-07 06:28:46,2024-01-30 02:23:39,True,https://placekitten.com/665/317
292,admit,Measure box bad store future. Dinner or land treatment program artist. Author social forward play.,method,practice,free,2021-11-01 14:10:32,2024-05-04 18:03:24,True,https://placekitten.com/583/743
293,win,Measure read open him light hundred. Several three protect blue last theory yard.,page,writer,type,2022-01-26 21:14:48,2024-06-03 12:09:07,True,https://placekitten.com/254/582
294,pressure,Science nature different natural where. Shake change like approach. Senior else ahead care before.,ahead,next,drug,2021-06-22 00:48:24,2024-02-13 04:49:30,False,https://www.lorempixel.com/849/1019
295,old,Down picture letter enjoy glass sort.,move,brother,cover,2023-10-22 21:31:23,2024-05-28 02:40:37,False,https://placeimg.com/610/467/any
296,employee,Message company five a effort social. Your remember fear.,not,add,likely,2022-04-14 05:47:05,2024-05-14 02:51:22,True,https://placekitten.com/447/673
297,likely,"Section hundred half price.
Second tree order experience. Rather stock bad how firm member throw.",never,skin,save,2022-08-04 10:02:37,2024-04-16 01:31:27,True,https://placeimg.com/701/22/any
298,record,Key management black tonight month bed least. Stand window respond. Second field with population.,heavy,war,production,2020-06-25 20:08:08,2024-04-30 03:12:07,True,https://www.lorempixel.com/527/40
299,attorney,Reality serious term pull. Office into water particularly. Check sound describe show beat.,far,may,through,2020-07-13 11:08:23,2024-05-26 19:44:39,False,https://placeimg.com/10/179/any
300,senior,Enough house through. Mention future sign role. Form pick born cause.,theory,child,shoulder,2024-04-17 04:01:01,2024-03-06 07:42:16,False,https://placekitten.com/321/594
