ProductGroupID,GroupName,GroupDescription,Category,SubCategory,Department,CreatedAt,UpdatedAt,IsActive,ImageURL
1,democratic,Plant lot be trade five. Seek wear spring with send popular. Total six yard entire back.,level,expert,north,2022-11-18 06:20:55,2024-05-29 22:19:28,True,https://placekitten.com/381/632
2,manager,Part life discover similar against blood. Seek necessary once college wind cell.,investment,toward,believe,2023-07-05 23:33:08,2024-02-07 13:51:53,False,https://placekitten.com/74/886
3,decade,Congress follow skin doctor identify vote. Produce go front lay also join.,statement,modern,feel,2023-11-10 17:14:02,2024-03-16 07:49:10,False,https://placekitten.com/294/495
4,chair,Though list son data. Wish decision agency establish those his far pass.,nice,whether,vote,2020-11-12 12:36:36,2024-02-08 15:11:35,False,https://dummyimage.com/165x587
5,item,Factor friend not. Small standard event product policy measure.,land,red,management,2021-02-25 15:59:33,2024-06-29 13:03:59,True,https://placekitten.com/374/833
6,ready,Drug current ability series perform edge. No policy coach back news another box.,take,family,firm,2023-04-14 07:16:02,2024-01-24 20:29:56,False,https://dummyimage.com/782x900
7,short,Yourself seven choice few. Mind place do rich live purpose. Age rule hand start.,catch,authority,follow,2020-12-06 07:12:18,2024-04-25 05:18:23,True,https://placeimg.com/939/465/any
8,student,Share imagine ok rest.,win,morning,stuff,2020-04-21 21:12:22,2024-06-24 06:42:34,True,https://www.lorempixel.com/114/1005
9,return,Everything what million.,expect,couple,them,2024-02-18 22:31:52,2024-01-30 22:30:28,True,https://placeimg.com/159/292/any
10,fight,Investment election result bank quickly yes. Who none everybody boy style.,Mr,son,hard,2021-06-26 14:48:42,2024-06-07 11:29:57,False,https://dummyimage.com/69x395
11,early,Fear modern culture. Pick explain general laugh really bill letter.,worker,to,up,2021-03-23 22:48:44,2024-01-25 22:08:20,False,https://www.lorempixel.com/123/171
12,this,Mr watch different fact. Memory behavior add little. Newspaper bar really me lay partner couple.,political,south,peace,2024-06-14 23:29:33,2024-04-16 09:27:07,False,https://placekitten.com/682/762
13,choice,Interest bit amount lay himself attack. Relationship hand fine provide laugh rest teach.,term,suffer,visit,2021-07-25 01:54:10,2024-04-04 11:19:05,False,https://placeimg.com/439/320/any
14,unit,Bad cause action PM challenge expert address fall. Employee lead help son remain rich every top.,arm,develop,plan,2023-03-26 16:02:44,2024-01-09 03:39:17,False,https://dummyimage.com/599x397
15,something,Skill teacher lawyer work join yourself.,prepare,education,water,2023-08-21 14:58:40,2024-06-21 01:42:46,True,https://dummyimage.com/329x743
16,stage,Gas interest begin late culture able.,response,while,turn,2024-03-21 14:48:46,2024-02-04 09:24:22,False,https://placeimg.com/720/448/any
17,character,Small front response civil learn on. Lose deep get. Above should effort green past they.,herself,growth,cup,2023-01-14 11:01:57,2024-01-22 17:32:04,True,https://placeimg.com/631/352/any
18,remember,Save lawyer blood explain effort center speech. Company according there reflect probably.,day,degree,probably,2024-04-12 01:35:19,2024-04-09 21:20:21,True,https://www.lorempixel.com/326/629
19,approach,Sing behavior think whether morning nothing. Will pull visit baby.,check,present,attorney,2022-04-16 22:51:15,2024-01-29 12:37:08,True,https://www.lorempixel.com/869/327
20,player,School share prevent very week main will. Drug now summer too. Major on thank as only.,soon,part,them,2021-10-28 17:46:08,2024-02-29 22:03:45,True,https://placeimg.com/828/788/any
21,specific,Head onto money need structure part expect amount. Place break against series several.,morning,protect,sure,2020-10-07 20:46:13,2024-01-07 16:21:21,False,https://dummyimage.com/279x52
22,experience,Property loss able foot.,democratic,reason,effort,2024-07-01 18:13:01,2024-03-11 00:39:23,False,https://placekitten.com/120/590
23,response,Special soon teach write off reach writer. The nature drop foreign because local.,sit,give,sit,2022-05-25 19:34:18,2024-03-15 17:50:04,False,https://placeimg.com/505/738/any
24,market,Past something rather ability most admit. Rate learn more nor government amount enjoy.,sister,mouth,quality,2020-09-13 02:54:39,2024-05-21 22:30:50,True,https://placeimg.com/940/228/any
25,occur,Trade star foot easy fact language poor offer. Almost player degree himself home quality.,tough,relate,live,2020-07-19 22:55:00,2024-02-11 23:05:11,False,https://dummyimage.com/365x408
26,one,Music hour program manager it. Town mouth inside kid culture central Congress especially.,mention,prepare,catch,2020-01-16 16:13:38,2024-05-05 15:03:25,False,https://www.lorempixel.com/108/694
27,laugh,Rule edge hard cost crime. Piece back expect leader resource camera play.,east,they,administration,2023-08-16 23:05:43,2024-06-24 08:27:33,True,https://dummyimage.com/80x521
28,base,Leg with reach human future third. Four term water born.,mouth,size,charge,2022-06-28 16:01:29,2024-02-23 15:04:32,False,https://www.lorempixel.com/473/373
29,across,Glass truth soldier hope return focus building. Could person light whatever wear.,exist,simple,leader,2024-05-19 03:40:21,2024-03-29 03:32:18,True,https://www.lorempixel.com/53/467
30,public,Responsibility group market cup. Husband always seat give.,successful,challenge,accept,2022-03-22 11:02:44,2024-03-17 13:28:18,True,https://www.lorempixel.com/168/113
31,it,Front break either cultural eat member. Different by too camera glass. Item become mother born so.,report,also,mention,2023-04-07 11:38:43,2024-02-18 14:17:46,False,https://placeimg.com/726/672/any
32,enough,Wide class guess item. None sit machine measure wife.,concern,learn,half,2022-07-28 11:21:12,2024-06-11 03:19:55,False,https://dummyimage.com/330x418
33,everything,Their event low certain like loss.,public,clearly,picture,2021-11-16 15:30:59,2024-04-14 12:39:32,True,https://www.lorempixel.com/840/189
34,debate,Think hit instead. Leave their century government. Suffer realize wall compare interest.,like,everybody,first,2022-06-29 15:46:45,2024-05-27 03:41:10,True,https://placekitten.com/200/672
35,somebody,Cut her blood film. Officer say security town. South produce mention consumer appear plan.,shake,best,office,2021-01-17 10:13:04,2024-03-03 02:08:10,False,https://dummyimage.com/390x995
36,student,Base citizen particular federal add maintain others. City difference pattern accept.,public,soldier,sense,2022-04-24 14:10:03,2024-05-09 05:06:03,False,https://placeimg.com/736/722/any
37,hear,Say wonder executive. Environment man despite other century two reach agree.,me,agency,artist,2020-01-04 02:06:07,2024-01-13 13:22:34,False,https://dummyimage.com/660x600
38,throw,Pick impact north democratic name yes traditional. Back you provide avoid yourself drop money full.,pattern,include,security,2020-04-11 15:34:44,2024-02-10 09:51:45,False,https://placekitten.com/814/328
39,risk,Upon could money. Work star goal I song.,budget,continue,lot,2021-08-08 15:35:17,2024-05-26 16:19:22,True,https://dummyimage.com/97x723
40,give,Teach if change room interesting. Style example growth from.,once,interest,food,2023-10-31 04:49:15,2024-01-26 15:09:51,True,https://placeimg.com/71/698/any
41,campaign,Work her region community attack choose area. Support about event both risk list marriage.,race,team,style,2021-03-28 21:29:44,2024-01-20 18:32:21,False,https://placeimg.com/752/1008/any
42,describe,"Moment glass believe. Tonight both born.
Seem improve movement group.",interview,price,film,2022-04-06 01:08:03,2024-01-25 00:28:38,True,https://placekitten.com/59/190
43,think,Partner crime will become. Sport animal happen risk window painting do.,soon,baby,environmental,2020-07-01 06:02:40,2024-04-12 09:05:18,False,https://placeimg.com/479/708/any
44,vote,Despite investment political language order. Year usually court later threat. Risk former forget.,pretty,blue,some,2022-04-19 10:51:15,2024-05-19 17:32:22,True,https://placekitten.com/1018/551
45,very,Challenge man indeed enjoy.,television,a,probably,2023-05-02 13:59:50,2024-05-08 16:32:23,False,https://placekitten.com/454/243
46,measure,Them for simple choose left. Move brother cultural part discover sister fund.,there,yes,compare,2023-03-03 00:46:27,2024-03-22 21:43:25,False,https://placekitten.com/912/1005
47,wife,Couple officer two style much worker dinner.,professional,far,one,2022-03-02 11:36:44,2024-04-13 23:03:57,True,https://dummyimage.com/287x752
48,thus,Long owner control rather teacher. Film up crime wind. Lead interest manager not huge leave toward.,stage,sense,animal,2022-08-09 15:06:32,2024-04-25 07:54:07,True,https://placekitten.com/253/95
49,usually,Size fine part ask perhaps likely decision close. Fight total cold wait.,thus,possible,film,2021-09-23 09:28:34,2024-06-18 14:14:45,False,https://www.lorempixel.com/278/254
50,town,Water how main also will. Lot wonder perhaps that down.,stage,animal,family,2023-11-25 15:24:30,2024-01-22 15:52:27,True,https://dummyimage.com/868x644
51,quality,Range attack traditional great. Prove week next. Particular hundred standard down upon picture.,example,short,church,2021-08-05 07:53:52,2024-06-18 04:34:29,True,https://placeimg.com/698/967/any
52,consider,Whom exist family phone. Voice eye last not. Campaign including same full meet.,laugh,anything,pretty,2021-10-17 06:12:12,2024-02-10 08:01:08,False,https://www.lorempixel.com/61/472
53,cover,Far civil drug they. What arm finally teacher check front history according.,future,material,find,2021-03-26 18:59:53,2024-06-20 06:59:30,True,https://placeimg.com/268/976/any
54,protect,Find understand recent. Center line room maintain. Ask field plant money conference.,end,part,happen,2020-07-20 09:57:58,2024-01-31 10:50:10,True,https://placekitten.com/883/839
55,model,Market easy read star. Pressure economic worker former. Possible quality member describe.,analysis,spend,computer,2022-07-08 03:27:31,2024-06-03 12:12:42,False,https://placeimg.com/718/1011/any
56,rule,Customer his site wall hundred young arrive. Then on about.,next,single,people,2020-07-24 10:52:17,2024-04-08 10:57:04,True,https://placekitten.com/592/807
57,share,Wait cut address once area rest door. Must tax exist performance less small help.,truth,road,these,2022-12-13 18:49:34,2024-03-19 20:48:56,True,https://dummyimage.com/1017x570
58,everybody,"Hot face six conference. Act threat suggest care late toward grow.
Ok final plant tough explain.",class,animal,history,2020-07-15 17:01:32,2024-03-11 23:49:49,True,https://placekitten.com/505/14
59,type,Truth usually soon strategy. Each wall mission board radio brother record.,PM,machine,last,2022-09-26 08:19:37,2024-03-09 22:08:10,True,https://placeimg.com/698/307/any
60,its,Increase allow option future. Hear road play avoid blue third. Ahead real people city discuss.,relationship,manage,just,2023-10-02 06:17:52,2024-05-24 08:17:02,True,https://placeimg.com/675/820/any
61,truth,Truth part me movement issue despite which that. Hope company company card approach.,still,use,wide,2024-06-15 20:26:16,2024-06-16 16:02:27,True,https://placeimg.com/983/650/any
62,community,Offer ever show eight. Foreign step medical such president result foreign.,method,board,indicate,2021-05-20 13:35:13,2024-06-25 22:47:25,False,https://placeimg.com/20/161/any
63,food,Personal card him method. Base choose continue see language.,hand,trip,wind,2020-08-24 02:38:49,2024-02-07 00:07:26,True,https://placekitten.com/817/6
64,medical,Miss no lead force company recent. Own food about every discuss.,commercial,note,operation,2024-05-14 10:30:10,2024-01-01 05:46:51,True,https://dummyimage.com/545x103
65,fish,Yard choose democratic edge wife. Store although side win probably to adult likely.,or,also,case,2022-04-15 17:03:05,2024-05-28 18:55:54,True,https://dummyimage.com/864x586
66,property,Conference establish focus test state coach bag. Environment second everything maybe describe.,international,say,care,2024-04-30 22:06:41,2024-02-29 12:47:22,True,https://placeimg.com/792/739/any
67,use,Step late during because. Admit myself yard possible fact. Spring minute modern.,president,staff,sing,2024-03-26 23:50:51,2024-01-07 00:34:51,False,https://placekitten.com/276/18
68,color,Individual month item hold. Experience again attention baby. Free wide talk someone.,sister,hot,star,2021-12-23 23:57:49,2024-02-07 05:46:29,True,https://www.lorempixel.com/69/407
69,since,Dinner teach reduce we book none. Still fill color particular special practice.,price,grow,relate,2021-12-29 23:18:24,2024-04-09 21:40:10,False,https://dummyimage.com/755x31
70,behind,Reach go ever five address serve boy actually. Past population hundred hundred appear fall he.,natural,report,face,2020-10-28 05:51:54,2024-01-12 02:05:03,False,https://placeimg.com/134/802/any
71,quite,"May grow expect small Republican star born. Its tend create dream.
My add lose hot.",interesting,manager,quickly,2023-02-12 04:12:26,2024-05-30 14:40:49,True,https://dummyimage.com/48x254
72,science,Center daughter southern three popular southern. Alone full claim school consumer put.,power,wear,yard,2021-07-11 19:24:28,2024-03-14 12:26:15,False,https://placeimg.com/245/523/any
73,include,Up under difficult instead. Source style memory range role great woman.,consumer,show,anyone,2022-04-26 21:28:19,2024-02-20 08:16:00,False,https://placekitten.com/533/910
74,such,Though with quite. Federal center ahead enjoy. Direction sit order against technology.,true,example,project,2020-12-23 06:08:01,2024-05-26 08:12:48,False,https://www.lorempixel.com/203/921
75,computer,If common war meet billion him. Whole listen myself line.,wait,toward,word,2021-01-15 09:29:51,2024-01-15 11:02:52,False,https://www.lorempixel.com/53/44
76,herself,Research give issue city note. Article study sea road court play win.,medical,rate,town,2023-10-01 13:18:04,2024-05-21 00:21:14,False,https://placeimg.com/568/929/any
77,relate,Since concern reason arm. Move be other way along.,instead,more,miss,2020-05-25 10:17:25,2024-01-30 18:28:09,False,https://placeimg.com/698/27/any
78,indicate,Recognize senior politics. Avoid thing very here kid success.,vote,here,recently,2023-07-17 22:40:43,2024-05-23 12:11:07,True,https://placekitten.com/990/914
79,arrive,Meet them economy reach another reduce. Air music wide style once a.,look,successful,significant,2021-09-21 19:41:45,2024-02-10 14:26:38,False,https://www.lorempixel.com/806/927
80,position,Yeah house edge. Song red truth chair sort.,century,over,support,2023-12-10 20:11:57,2024-01-05 11:35:06,False,https://placeimg.com/499/593/any
81,teach,Be movie five type. Lay everything purpose green agent give word however.,believe,war,place,2023-12-11 13:35:47,2024-04-17 14:17:13,True,https://www.lorempixel.com/879/753
82,road,Real against social. Expect business with that necessary within seven ready. Three I coach federal.,likely,pretty,everyone,2024-02-26 03:34:25,2024-01-28 03:18:36,False,https://www.lorempixel.com/532/175
83,here,Reason cell task nation. Operation cut under notice former major well. Two under draw choice skill.,notice,political,economy,2020-12-05 05:31:22,2024-01-07 03:06:40,False,https://www.lorempixel.com/276/375
84,pay,"Nor simple wear reason call smile close.
Technology place organization time indeed list.",present,me,city,2022-06-08 00:12:02,2024-04-09 15:21:39,False,https://placekitten.com/831/1024
85,reflect,Catch including treat be every court sit individual. Important site make foot defense.,shoulder,itself,student,2021-04-10 21:32:59,2024-04-14 12:34:00,False,https://www.lorempixel.com/480/167
86,energy,Long project call picture traditional kind. Send stock often mind tonight out.,training,myself,stock,2024-03-12 20:29:10,2024-01-07 18:29:40,True,https://placekitten.com/417/784
87,today,Commercial building one ground sense use. Religious for appear different worry. Minute every best.,fine,serve,difference,2022-04-12 07:00:48,2024-01-05 21:10:43,False,https://placekitten.com/472/138
88,major,Arm majority best. Owner person question general staff.,represent,cold,agree,2020-09-02 12:43:23,2024-05-11 19:03:58,False,https://dummyimage.com/949x79
89,medical,Church chair recently performance staff knowledge. Whatever result thank pay try.,management,soon,walk,2022-02-07 16:01:27,2024-01-08 15:08:36,False,https://dummyimage.com/96x623
90,line,Future even campaign sign system drive wall wonder. Finally response guy born land.,director,tax,why,2020-03-12 03:18:35,2024-02-29 01:18:21,True,https://placeimg.com/469/110/any
91,rise,"Inside carry church test share.
White gas decide thing many. Effort how much paper see.",meet,generation,task,2022-08-10 19:50:05,2024-05-03 03:45:04,False,https://dummyimage.com/854x712
92,future,Trial me trial effort. Way him billion prevent fall practice may. General close particular.,hospital,house,fish,2021-11-17 22:49:19,2024-06-06 20:07:29,True,https://dummyimage.com/171x270
93,note,Any interest similar. Field hundred contain drug interesting.,part,begin,audience,2020-04-11 23:19:02,2024-02-07 07:36:02,True,https://www.lorempixel.com/744/518
94,matter,Include than stop manager many office ten. After own everything plan research hard reason.,agree,tonight,term,2021-07-05 15:31:51,2024-06-11 12:27:10,False,https://www.lorempixel.com/768/375
95,opportunity,It local moment strong trouble. Cost follow second doctor surface into.,anyone,over,evening,2021-11-24 10:22:46,2024-02-22 17:37:08,False,https://www.lorempixel.com/231/254
96,charge,Next stand address recognize left improve arm. Perform really computer take including suffer.,performance,career,note,2020-06-01 03:49:00,2024-05-17 09:50:59,True,https://www.lorempixel.com/805/374
97,explain,Bar policy plan service. Former expect open reflect serious.,data,sound,hard,2022-08-17 03:42:33,2024-03-25 23:12:57,False,https://placeimg.com/654/795/any
98,mouth,Surface will main poor view. Policy on program. Particular stock raise culture save remember.,born,life,close,2020-01-31 14:04:49,2024-06-17 06:22:17,True,https://www.lorempixel.com/422/502
99,them,Nice majority likely senior.,all,guess,artist,2022-10-07 22:47:10,2024-03-15 08:32:24,False,https://www.lorempixel.com/159/293
100,also,Live particular new seat. Letter marriage religious trouble candidate various line.,benefit,run,region,2021-07-18 02:11:54,2024-03-22 20:56:01,False,https://placekitten.com/416/246
101,gas,Politics computer value character floor social. Truth yourself choose my.,away,air,stay,2023-10-05 01:56:30,2024-05-11 09:11:52,True,https://placeimg.com/872/516/any
102,need,Else onto mind mind more. Minute quickly anything trade future. Alone side return onto.,be,painting,computer,2021-04-06 03:38:17,2024-03-09 23:04:08,True,https://dummyimage.com/569x806
103,try,Each together ask off. Population hospital lay toward avoid.,top,coach,more,2022-09-17 11:47:30,2024-02-09 16:14:48,True,https://placekitten.com/255/308
104,their,Mind act benefit south young partner. Hear material lot sound sound design those world.,matter,others,fight,2024-06-24 13:58:02,2024-02-29 01:24:18,False,https://www.lorempixel.com/715/277
105,reality,Over place their be. Ground information page create smile good those shake.,information,imagine,must,2024-06-06 00:25:05,2024-06-28 20:21:20,False,https://dummyimage.com/242x440
106,why,Impact green minute. Force threat Republican but find including environmental.,simple,common,wear,2023-12-29 05:47:10,2024-06-07 08:57:02,False,https://placekitten.com/104/351
107,character,Section guess daughter hour will business at. Page reach cell friend.,tell,identify,future,2020-10-11 08:05:50,2024-06-25 10:44:48,True,https://dummyimage.com/101x165
108,stay,Compare ground would from will. Eye some politics argue exist government green.,force,rule,front,2021-05-20 02:51:16,2024-04-20 22:33:30,False,https://dummyimage.com/80x593
109,need,Billion public today move material. Effect right best. Sell amount walk drop.,pressure,western,age,2024-06-13 10:18:06,2024-03-11 04:46:10,False,https://placekitten.com/721/605
110,compare,Tend back billion forget operation wear. Movement lead officer. Eye beautiful town scene among.,series,firm,through,2022-08-15 20:23:36,2024-06-20 01:08:18,True,https://placeimg.com/895/156/any
111,who,All option window unit well throughout all. Crime safe focus sure.,fight,experience,set,2020-02-09 03:12:00,2024-05-17 02:07:44,True,https://placekitten.com/716/418
112,focus,Huge worker police. Always example bit that fear seat. Choose station nature.,another,choose,house,2021-03-21 09:26:10,2024-05-19 16:56:16,False,https://placeimg.com/196/680/any
113,section,Study side body how body factor. Day theory spend process number.,production,main,voice,2022-07-13 00:26:45,2024-05-12 01:17:28,True,https://placeimg.com/559/475/any
114,another,Pull media inside model item old. Apply way economic school.,perform,act,expert,2022-07-09 20:37:05,2024-04-14 07:42:52,True,https://www.lorempixel.com/479/881
115,southern,Expert capital product college kid specific economic. Then kid option.,ever,consider,language,2022-10-10 16:37:16,2024-01-01 19:37:11,True,https://dummyimage.com/910x261
116,college,About know shoulder dinner amount. Let picture consumer pull consumer.,street,foreign,loss,2022-12-06 21:12:43,2024-02-02 14:00:48,True,https://www.lorempixel.com/186/1003
117,reach,Nor thousand great subject. Also particularly if resource.,pull,machine,what,2023-01-06 06:00:01,2024-06-11 07:20:37,False,https://www.lorempixel.com/705/215
118,good,Into notice result stock weight. Capital state interest rock culture.,so,specific,mention,2020-01-02 22:24:43,2024-02-24 15:11:58,False,https://www.lorempixel.com/578/684
119,arm,They she cultural blood section artist. Realize past past within.,boy,statement,available,2023-05-05 06:57:15,2024-03-01 15:47:19,True,https://www.lorempixel.com/823/557
120,power,Go send news order. Commercial need seven help agency.,success,cause,what,2020-03-13 19:05:09,2024-06-11 05:50:51,True,https://www.lorempixel.com/97/41
121,example,Last idea rock light bed skill. Hear main sing how fly different.,that,Republican,research,2022-11-25 06:38:19,2024-02-29 11:45:32,True,https://placekitten.com/193/918
122,middle,Dinner my American campaign environmental always magazine control.,color,customer,a,2023-07-18 05:36:22,2024-06-01 10:29:59,True,https://dummyimage.com/912x426
123,plant,Police somebody end degree when. Design water argue bring their. Car degree region while success.,still,enough,approach,2023-07-09 19:28:07,2024-02-06 12:48:34,False,https://placeimg.com/227/1008/any
124,assume,Better report class heart other over reach price.,sit,decision,agree,2024-02-21 20:32:44,2024-01-12 09:07:18,True,https://placekitten.com/631/489
125,near,Hand enough let. Case oil even. Believe hit end land.,work,can,price,2023-07-03 16:06:34,2024-02-24 09:30:46,False,https://placekitten.com/883/953
126,structure,Employee one participant interview book. Product minute seat weight represent word brother.,continue,development,eat,2024-05-17 11:24:29,2024-05-19 19:06:55,True,https://placeimg.com/297/629/any
127,draw,Resource one yard determine industry deal win nothing. Meeting record either again.,bank,because,speech,2021-11-07 16:37:16,2024-04-10 13:21:30,True,https://placeimg.com/405/541/any
128,majority,Around relationship state radio. Worker character its.,throw,health,spring,2024-05-20 09:49:03,2024-05-08 06:49:47,False,https://placekitten.com/864/498
129,ask,Evidence first push audience. Add state science eye network source month.,close,face,nature,2021-10-03 09:17:12,2024-04-20 23:01:08,True,https://www.lorempixel.com/907/40
130,weight,Fly keep into common evening. Central popular again raise above.,next,change,she,2020-04-28 17:17:52,2024-02-10 13:47:38,True,https://placeimg.com/56/969/any
131,president,Find ball into take machine. Game enter land them. Draw blood enough garden current station.,quality,this,fish,2022-11-06 22:11:59,2024-02-09 20:48:53,False,https://placeimg.com/1003/265/any
132,rest,Product fund everything can may show book. Exactly money relate until office.,beat,game,TV,2022-10-30 17:05:43,2024-05-18 19:41:22,True,https://dummyimage.com/465x385
133,bit,"Price author former pick. Policy phone any body.
Hundred term act end. Determine their realize.",son,wrong,wish,2023-02-07 18:32:28,2024-05-29 13:01:15,False,https://www.lorempixel.com/311/42
134,black,Special cost weight late wife ground admit. Outside oil she laugh ball occur.,whole,give,participant,2024-01-29 21:11:15,2024-02-20 00:45:00,True,https://www.lorempixel.com/1008/759
135,exactly,Military argue teach already town require say. Easy society author free.,front,institution,exist,2023-05-10 21:29:12,2024-02-22 04:14:45,True,https://placekitten.com/922/210
136,accept,Few garden produce show. Try space force article level.,why,part,serious,2021-06-24 16:44:03,2024-06-07 21:50:38,False,https://dummyimage.com/189x977
137,and,Piece expect teach your various and. Any have mission east.,reduce,attorney,one,2022-07-25 02:46:34,2024-01-03 13:46:30,True,https://placekitten.com/920/251
138,Congress,Knowledge house phone tax wait. Especially dream center prepare around issue level.,others,land,question,2020-12-27 19:38:25,2024-04-13 13:06:18,True,https://www.lorempixel.com/443/526
139,author,Sign shake somebody production yet. Serious nation base image. Hotel east effect opportunity sell.,start,may,raise,2021-05-17 00:33:45,2024-03-31 07:14:13,False,https://placeimg.com/588/642/any
140,door,Live use necessary teacher evidence accept land everything. Trouble pretty hope effort boy.,true,another,cold,2022-11-07 15:53:27,2024-05-30 23:39:20,False,https://www.lorempixel.com/205/862
141,whose,Force present budget assume democratic. Reality yeah end pass gun.,hard,number,camera,2022-07-04 17:51:08,2024-06-05 15:45:08,False,https://dummyimage.com/373x640
